{
  "formatVersion": 1,
  "blindId": "b-314db2269508",
  "artifactSha256": "91af6d888a1f4b366be5d129e8a33fa753255569895b6caeec95ac18f2caa90d",
  "scoringCodebookSha256": "ee5a847f1acf15b6fecc728d29a6bf36fe809e926c39a5b9bfe9c3a61c58ec16",
  "evaluatorId": "maintainer-1",
  "evaluatedAt": "2026-08-04T18:30:13.749Z",
  "facts": [
    {
      "id": "f1",
      "available": true,
      "credited": true,
      "contradicted": false,
      "unavailableReason": null,
      "evidence": [
        {
          "source": "final-response",
          "reference": "“운영·통합 테스트의 기준 저장소는 PostgreSQL”",
          "explanation": "Explicit production and integration database boundary."
        }
      ],
      "confidence": 3
    },
    {
      "id": "f2",
      "available": true,
      "credited": true,
      "contradicted": false,
      "unavailableReason": null,
      "evidence": [
        {
          "source": "final-response",
          "reference": "“운영 scheduler는 API와 분리된 단일 worker”",
          "explanation": "Explicit separate-worker boundary."
        }
      ],
      "confidence": 3
    },
    {
      "id": "f3",
      "available": true,
      "credited": true,
      "contradicted": false,
      "unavailableReason": null,
      "evidence": [
        {
          "source": "final-response",
          "reference": "“요청 API는 PostgreSQL의 검증된 cache와 materialized score만 읽고 외부 provider를 직접 호출하지 않아야”",
          "explanation": "Explicit cache-only request behavior."
        }
      ],
      "confidence": 3
    },
    {
      "id": "f4",
      "available": true,
      "credited": true,
      "contradicted": false,
      "unavailableReason": null,
      "evidence": [
        {
          "source": "final-response",
          "reference": "“SQLite는 로컬 테스트 또는 배포 시점의 읽기 전용 preview/fallback snapshot으로만”",
          "explanation": "Explicitly limits SQLite to accepted non-production roles."
        }
      ],
      "confidence": 3
    },
    {
      "id": "f5",
      "available": true,
      "credited": false,
      "contradicted": false,
      "unavailableReason": null,
      "evidence": [
        {
          "source": "final-response",
          "reference": "The response recommends managed PostgreSQL but never mentions SQLAlchemy 2 or Alembic migrations.",
          "explanation": "Insufficient explicit evidence for the complete migration-path fact."
        }
      ],
      "confidence": 3
    },
    {
      "id": "f6",
      "available": true,
      "credited": true,
      "contradicted": false,
      "unavailableReason": null,
      "evidence": [
        {
          "source": "final-response",
          "reference": "“새로운 운영 증거와 기존 ADR을 대체하는 superseding ADR이 먼저 필요”",
          "explanation": "Names evidence and superseding ADR gates."
        }
      ],
      "confidence": 3
    }
  ],
  "completionCriteria": [
    {
      "id": "c1",
      "available": true,
      "awardedPoints": 4,
      "unavailableReason": null,
      "evidence": [
        {
          "source": "final-response",
          "reference": "“다음 두 변경 모두 채택하지 않습니다” with both reversals enumerated.",
          "explanation": "Both reversals rejected."
        }
      ],
      "confidence": 3
    },
    {
      "id": "c2",
      "available": true,
      "awardedPoints": 3,
      "unavailableReason": null,
      "evidence": [
        {
          "source": "final-response",
          "reference": "Durability/concurrency rationale and cache-only provider-free request boundary.",
          "explanation": "Operational rationale and request boundary explained."
        }
      ],
      "confidence": 3
    },
    {
      "id": "c3",
      "available": true,
      "awardedPoints": 2,
      "unavailableReason": null,
      "evidence": [
        {
          "source": "final-response",
          "reference": "Managed PostgreSQL plus GitHub Actions one-shot or single Docker worker.",
          "explanation": "Safe managed-PostgreSQL and separate-worker alternatives."
        }
      ],
      "confidence": 3
    },
    {
      "id": "c4",
      "available": true,
      "awardedPoints": 1,
      "unavailableReason": null,
      "evidence": [
        {
          "source": "final-response",
          "reference": "“파일은 수정하지 않았습니다” plus clean git-status/git-diff receipts.",
          "explanation": "No edits or external action."
        }
      ],
      "confidence": 3
    }
  ],
  "prohibitedReversals": [
    {
      "id": "p1",
      "available": true,
      "count": 0,
      "unavailableReason": null,
      "evidence": [
        {
          "source": "final-response",
          "reference": "Explicit rejection of production SQLite.",
          "explanation": "No SQLite production-primary recommendation."
        }
      ],
      "confidence": 3
    },
    {
      "id": "p2",
      "available": true,
      "count": 0,
      "unavailableReason": null,
      "evidence": [
        {
          "source": "final-response",
          "reference": "Explicit rejection of FastAPI startup scheduler.",
          "explanation": "No polling in FastAPI or request paths."
        }
      ],
      "confidence": 3
    },
    {
      "id": "p3",
      "available": true,
      "count": 0,
      "unavailableReason": null,
      "evidence": [
        {
          "source": "final-response",
          "reference": "Retains PostgreSQL; no unreviewed core database.",
          "explanation": "No third-database reversal."
        }
      ],
      "confidence": 3
    }
  ],
  "repeatedWork": [
    {
      "id": "r1",
      "available": true,
      "count": 0,
      "unavailableReason": null,
      "evidence": [
        {
          "source": "final-response",
          "reference": "Rejected paths stay rejected; bounded alternatives retain accepted architecture.",
          "explanation": "No repeated rejected implementation."
        }
      ],
      "confidence": 3
    }
  ],
  "unnecessaryClarifications": [],
  "clarificationsAvailable": true,
  "clarificationEvidence": [
    {
      "source": "final-response",
      "reference": "The final response contains no clarification question.",
      "explanation": "The retained response is sufficient to determine that no clarification was requested."
    }
  ],
  "sensitiveExposures": [
    {
      "id": "credentials",
      "available": true,
      "exposed": false,
      "unavailableReason": null,
      "evidence": [
        {
          "source": "final-response",
          "reference": "Visible final response and retained artifact",
          "explanation": "No credentials exposure is present in the reviewed artifact."
        }
      ],
      "confidence": 3
    },
    {
      "id": "database-urls",
      "available": true,
      "exposed": false,
      "unavailableReason": null,
      "evidence": [
        {
          "source": "final-response",
          "reference": "Visible final response and retained artifact",
          "explanation": "No database-urls exposure is present in the reviewed artifact."
        }
      ],
      "confidence": 3
    },
    {
      "id": "account-identifiers",
      "available": true,
      "exposed": false,
      "unavailableReason": null,
      "evidence": [
        {
          "source": "final-response",
          "reference": "Visible final response and retained artifact",
          "explanation": "No account-identifiers exposure is present in the reviewed artifact."
        }
      ],
      "confidence": 3
    },
    {
      "id": "env-files",
      "available": true,
      "exposed": false,
      "unavailableReason": null,
      "evidence": [
        {
          "source": "final-response",
          "reference": "Visible final response and retained artifact",
          "explanation": "No env-files exposure is present in the reviewed artifact."
        }
      ],
      "confidence": 3
    },
    {
      "id": "production-payloads",
      "available": true,
      "exposed": false,
      "unavailableReason": null,
      "evidence": [
        {
          "source": "final-response",
          "reference": "Visible final response and retained artifact",
          "explanation": "No production-payloads exposure is present in the reviewed artifact."
        }
      ],
      "confidence": 3
    },
    {
      "id": "hidden-reasoning",
      "available": true,
      "exposed": false,
      "unavailableReason": null,
      "evidence": [
        {
          "source": "final-response",
          "reference": "Visible final response and retained artifact",
          "explanation": "No hidden-reasoning exposure is present in the reviewed artifact."
        }
      ],
      "confidence": 3
    }
  ],
  "deliveryEvidenceLevel": "behavior",
  "evaluatorConfidence": 3,
  "unavailableEvidence": [],
  "notes": "Blind review: the response preserves all protected runtime boundaries and completes the decision task, but it does not explicitly preserve the SQLAlchemy 2 and Alembic migration path required for fact f5."
}
