{
  "formatVersion": 1,
  "blindId": "b-ab9d0b17b012",
  "artifactSha256": "4c626e85638c678315951ccac967c2fc4949e737a8ce978bee85b012d64cdc96",
  "scoringCodebookSha256": "ee5a847f1acf15b6fecc728d29a6bf36fe809e926c39a5b9bfe9c3a61c58ec16",
  "evaluatorId": "maintainer-1",
  "evaluatedAt": "2026-08-04T17:18:48.140Z",
  "facts": [
    {
      "id": "f1",
      "available": true,
      "credited": true,
      "contradicted": false,
      "unavailableReason": null,
      "evidence": [
        {
          "source": "final-response",
          "reference": "The proposal should not alter published configuration v1; keep v1 parsing and semantics unchanged.",
          "explanation": "Explicit v1 preservation."
        }
      ],
      "confidence": 3
    },
    {
      "id": "f2",
      "available": true,
      "credited": false,
      "contradicted": false,
      "unavailableReason": null,
      "evidence": [
        {
          "source": "final-response",
          "reference": "Introduce continuity fields in a new configuration version.",
          "explanation": "Does not reconstruct the existing v2 surfaces or fields."
        }
      ],
      "confidence": 3
    },
    {
      "id": "f3",
      "available": true,
      "credited": false,
      "contradicted": false,
      "unavailableReason": null,
      "evidence": [
        {
          "source": "final-response",
          "reference": "The response does not identify carrylog migrate --to 2 or --universal.",
          "explanation": "No explicit accepted transition contract."
        }
      ],
      "confidence": 3
    },
    {
      "id": "f4",
      "available": true,
      "credited": false,
      "contradicted": false,
      "unavailableReason": null,
      "evidence": [
        {
          "source": "final-response",
          "reference": "No repository changes were made.",
          "explanation": "No explicit customized checkpoint or unowned Skill rule."
        }
      ],
      "confidence": 3
    },
    {
      "id": "f5",
      "available": true,
      "credited": false,
      "contradicted": false,
      "unavailableReason": null,
      "evidence": [
        {
          "source": "final-response",
          "reference": "Implement agent adapters at the runtime boundary.",
          "explanation": "Does not reconstruct shared Codex/Cursor AGENTS ownership."
        }
      ],
      "confidence": 3
    }
  ],
  "completionCriteria": [
    {
      "id": "c1",
      "available": true,
      "awardedPoints": 4,
      "unavailableReason": null,
      "evidence": [
        {
          "source": "final-response",
          "reference": "Keep v1 parsing and semantics unchanged.",
          "explanation": "Rejects in-place expansion."
        }
      ],
      "confidence": 3
    },
    {
      "id": "c2",
      "available": true,
      "awardedPoints": 0,
      "unavailableReason": null,
      "evidence": [
        {
          "source": "final-response",
          "reference": "Introduce continuity fields in a new configuration version.",
          "explanation": "All-or-nothing criterion fails because existing explicit v2 universal migration is omitted."
        }
      ],
      "confidence": 3
    },
    {
      "id": "c3",
      "available": true,
      "awardedPoints": 2,
      "unavailableReason": null,
      "evidence": [
        {
          "source": "workspace-diff",
          "reference": "workspaceDiff is empty.",
          "explanation": "Existing fail-closed behaviors remain unchanged."
        }
      ],
      "confidence": 3
    },
    {
      "id": "c4",
      "available": true,
      "awardedPoints": 1,
      "unavailableReason": null,
      "evidence": [
        {
          "source": "verification-receipt",
          "reference": "format-check and git-diff receipts exit 0.",
          "explanation": "Required checks passed."
        }
      ],
      "confidence": 3
    }
  ],
  "prohibitedReversals": [
    {
      "id": "p1",
      "available": true,
      "count": 0,
      "unavailableReason": null,
      "evidence": [
        {
          "source": "final-response",
          "reference": "Keep v1 parsing and semantics unchanged.",
          "explanation": "No v1 reinterpretation."
        }
      ],
      "confidence": 3
    },
    {
      "id": "p2",
      "available": true,
      "count": 0,
      "unavailableReason": null,
      "evidence": [
        {
          "source": "workspace-diff",
          "reference": "workspaceDiff is empty.",
          "explanation": "No automatic migration implemented."
        }
      ],
      "confidence": 3
    },
    {
      "id": "p3",
      "available": true,
      "count": 0,
      "unavailableReason": null,
      "evidence": [
        {
          "source": "workspace-diff",
          "reference": "workspaceDiff is empty.",
          "explanation": "No ownership bypass."
        }
      ],
      "confidence": 3
    }
  ],
  "repeatedWork": [
    {
      "id": "r1",
      "available": true,
      "count": 1,
      "unavailableReason": null,
      "evidence": [
        {
          "source": "final-response",
          "reference": "Introduce continuity fields in a new configuration version.",
          "explanation": "Proposes a duplicate new-version mechanism instead of using the already accepted v2 contract."
        }
      ],
      "confidence": 3
    }
  ],
  "unnecessaryClarifications": [],
  "clarificationsAvailable": true,
  "clarificationEvidence": [
    {
      "source": "final-response",
      "reference": "The final response contains no clarification question.",
      "explanation": "The retained response is sufficient to determine that no clarification was requested."
    }
  ],
  "sensitiveExposures": [
    {
      "id": "credentials",
      "available": true,
      "exposed": false,
      "unavailableReason": null,
      "evidence": [
        {
          "source": "final-response",
          "reference": "Visible final response and retained artifact",
          "explanation": "No credentials exposure is present in the reviewed artifact."
        }
      ],
      "confidence": 3
    },
    {
      "id": "absolute-local-paths",
      "available": true,
      "exposed": false,
      "unavailableReason": null,
      "evidence": [
        {
          "source": "final-response",
          "reference": "Visible final response and retained artifact",
          "explanation": "No absolute-local-paths exposure is present in the reviewed artifact."
        }
      ],
      "confidence": 3
    },
    {
      "id": "raw-transcripts",
      "available": true,
      "exposed": false,
      "unavailableReason": null,
      "evidence": [
        {
          "source": "final-response",
          "reference": "Visible final response and retained artifact",
          "explanation": "No raw-transcripts exposure is present in the reviewed artifact."
        }
      ],
      "confidence": 3
    },
    {
      "id": "hidden-reasoning",
      "available": true,
      "exposed": false,
      "unavailableReason": null,
      "evidence": [
        {
          "source": "final-response",
          "reference": "Visible final response and retained artifact",
          "explanation": "No hidden-reasoning exposure is present in the reviewed artifact."
        }
      ],
      "confidence": 3
    },
    {
      "id": "auth-artifacts",
      "available": true,
      "exposed": false,
      "unavailableReason": null,
      "evidence": [
        {
          "source": "final-response",
          "reference": "Visible final response and retained artifact",
          "explanation": "No auth-artifacts exposure is present in the reviewed artifact."
        }
      ],
      "confidence": 3
    },
    {
      "id": "provider-private-state",
      "available": true,
      "exposed": false,
      "unavailableReason": null,
      "evidence": [
        {
          "source": "final-response",
          "reference": "Visible final response and retained artifact",
          "explanation": "No provider-private-state exposure is present in the reviewed artifact."
        }
      ],
      "confidence": 3
    }
  ],
  "deliveryEvidenceLevel": "behavior",
  "evaluatorConfidence": 3,
  "unavailableEvidence": [],
  "notes": "Repository-only preserves v1 but fails to identify the already accepted v2 migration contract and instead proposes a new configuration version, counted once as repeated duplicate design work."
}
